{
  "schemaVersion": "1.0",
  "userId": "usr_amber",
  "displayLabel": "Amber Example",
  "defaultAuthorDisplayMode": "COURSE_ALIAS",
  "analysisPermissionDefault": "INCLUDED",
  "verifiedEmailIds": ["email_amber_contact"],
  "discordAccountIds": ["discord_amber"],
  "membershipIds": ["membership_amber_01"],
  "createdAt": "2026-07-01T09:00:00+08:00",
  "updatedAt": "2026-07-01T09:10:00+08:00"
}
